source,title,company,location,published,deadline,url,matched_in,snippet,status_note
Störf.is,Rekstrar- og viðhaldsstjóri – Björgun Sement,Hagvangur,Iceland,2026-05-07T03:46:07.661173Z,,https://www.hagvangur.is/jobs/rekstrar-og-vidhaldsstjori-bjorgun-sement/,content,"erktaka, framleiðenda, hönnuða og annarra hagsmunaaðila Tæknilegur stuðningur og þátttaka í innleiðingu nýrra tækni- og gervigreindarlausna Þátttaka í gæða-, öryggis- og mannauðsmálum tengdum framkvæmdum og viðhaldi Menntunar- og hæfniskröfur Menntun í vél-, iðn-, tæknifræði eða önnur menntun og reynsla sem nýtist í st",
Störf.is,Verkefnastjóri í fjármálatengdum verkefnum,Háskóli Íslands,"Reykjavík, Höfuðborgarsvæðið",2026-05-06T03:18:15.809931Z,2026-05-15T00:00:00,https://island.is/starfatorg/x-46504,content,"um greinum sem nýtast í starfi Góð færni í Excel Gott vald á upplýsingatækni og hæfni til að nýta nýjungar, þar á meðal gervigreind og stafrænar lausnir, til umbóta í starfi Reynsla af sambærilegum verkefnum er kostur Góð samstarfshæfni og rík þjónustulund Sjálfstæð, skipulögð og lausnamiðuð vinnubrögð Góð færni í ísle",Merged from 2 matching source postings.
Tvinna,C# forritari hjá Meniga,Meniga,Iceland,1. Jul 2011,,https://www.tvinna.is/jobs/c-forritari-hja-meniga/,content,"gð og hefur áhrif á þróun vörunnar. Meðal verkefna er forritun nýjunga í C#, hönnun gagnagrunna og vöruhúsa, útfærsla á gervigreind, flóknum algrímum, aðlögun að netbönkum erlendra banka o.fl. Við bjóðum góð laun, gott vinnuumhverfi og skemmtilegan vinnustað. Meniga er leiðandi í þróun heimilisfjármála veflausna (PFM)",
Tvinna,Framendaforritari,Helix Health,Iceland,29. Mar 2026,,https://www.tvinna.is/jobs/framendaforritari-31/,content,"nnuðum, vörustjórum og þróunarteymi að því að skapa notendavænar og árangursríkar lausnir Nýta ný tól og aðferðir (m.a. gervigreind) til að auka skilvirkni og gæði í þróun Sjá til þess að þróun framenda fylgi viðurkenndum og bestu verklagsreglum, með áherslu á gæði, aðgengi og viðhald Vera málsvari fyrir góða notendaup",
Tvinna,Full Stack forritari,Helix Health,Iceland,29. Mar 2026,,https://www.tvinna.is/jobs/full-stack-forritari-10/,content,"na náið með fjölbreyttum teymum með því markmiði að skapa öflugar og áreiðanlegar lausnir Nýta ný tól og aðferðir (m.a. gervigreind) til að auka skilvirkni og gæði í þróun Sjá til þess að þróun bakenda fylgi viðurkenndum vinnulögum og bestu verklagsreglum, með áherslu á gæði, öryggi og viðhald Taka þátt í samþættingu m",
Tvinna,Sérfræðingar í gervigreind/máltækni,Háskólinn í Reykjavík,Iceland,10. Oct 2019,,https://www.tvinna.is/jobs/serfraedingar-i-gervigreind-maltaekni/,title,Sérfræðingar í gervigreind/máltækni Um Tvinna Auglýstu starf Um Tvinna Auglýstu starf Sérfræðingar í gervigreind/máltækni Háskólinn í Reykjavík 10. Oct 2019 Fullt starf Gervigreindarsetur Háskólans í Reykjavík leitar að metnaðarfullum einstaklingum til að starfa við þróun og gerð talgreina og annarra máltæknilausna. Þr,
Tvinna,"Sérfræðingur í spunagreind, máltækni og mállíkönum",Íslandsbanka,Iceland,11. Oct 2023,,https://www.tvinna.is/jobs/serfraedingur-i-spunagreind-maltaekni-og-mallikonum/,content,"leita að öflugu og metnaðarfullu starfsfólki til að vinna að vegferð bankans í hagnýtingu spunagreindar (e. generative AI), máltækni (e. natural language processing) og risamállíkana (e. large language models, LLMs) í fjölbreyttu og spennandi starfsumhverfi. Með nýtingu máltækni og gervigreindar viljum við gera góða þ",
Tvinna,Vörustjóri gervigreindar – AI Product manager,Orkuveitan,Iceland,3. Sep 2024,,https://www.tvinna.is/jobs/vorustjori-gervigreindar-ai-product-manager/,title,"Vörustjóri gervigreindar – AI Product manager Um Tvinna Auglýstu starf Um Tvinna Auglýstu starf Vörustjóri gervigreindar – AI Product manager Orkuveitan 3. Sep 2024 Fullt starf Vörustjóri í hagnýtingu gervigreindar Við leitum að skipulögðum, drífandi og hugmyndaríkum leiðtoga í hagnýtingu gervigreindar hjá Orkuveitunni",
